<?xml version="1.0" encoding="UTF-8"?>
<?xml-stylesheet type="text/xsl" href="transform.xsl"?>
<!DOCTYPE users SYSTEM "users.dtd">
<users xmlns:xsi="http://www.w3.org/2001/XMLSchema-instance" xsi:noNamespaceSchemaLocation="users.xsd">
  <user>
    <name>Sas</name>
    <surrname>Zombie</surrname>
    <preferedTheme>Magic</preferedTheme>
    <readingLvl>Intermediate</readingLvl>
  </user>
    <user>
        <name>Salut</name>
        <surrname>Sas</surrname>
        <preferedTheme>Magic</preferedTheme>
        <readingLvl>Beginer</readingLvl>
    </user>
</users>